{
  "$schema": "../schemas/atlas.schema.json",
  "id": "europe",
  "name": "Europe",
  "description": "European countries including EU members (27), non-EU states, and overseas territories",
  "category": "region",
  "dataSources": {
    "territories": "europe-territories-50m.json",
    "metadata": "europe-metadata-50m.json"
  },
  "territories": [
    {
      "id": "40",
      "role": "member",
      "code": "AT",
      "name": "Austria",
      "iso": "AUT",
      "center": [
        13.33,
        47.33
      ],
      "bounds": [
        [
          9.5,
          46.4
        ],
        [
          17.2,
          49
        ]
      ],
      "extraction": {}
    },
    {
      "id": "56",
      "role": "member",
      "code": "BE",
      "name": "Belgium",
      "iso": "BEL",
      "center": [
        4.67,
        50.63
      ],
      "bounds": [
        [
          2.5,
          49.5
        ],
        [
          6.4,
          51.5
        ]
      ],
      "extraction": {}
    },
    {
      "id": "100",
      "role": "member",
      "code": "BG",
      "name": "Bulgaria",
      "iso": "BGR",
      "center": [
        25,
        43
      ],
      "bounds": [
        [
          22.4,
          41.2
        ],
        [
          28.6,
          44.2
        ]
      ],
      "extraction": {}
    },
    {
      "id": "191",
      "role": "member",
      "code": "HR",
      "name": "Croatia",
      "iso": "HRV",
      "center": [
        16,
        45
      ],
      "bounds": [
        [
          13.5,
          42.4
        ],
        [
          19.4,
          46.5
        ]
      ],
      "extraction": {}
    },
    {
      "id": "196",
      "role": "member",
      "code": "CY",
      "name": "Cyprus",
      "iso": "CYP",
      "center": [
        33,
        35
      ],
      "bounds": [
        [
          32.3,
          34.6
        ],
        [
          34.6,
          35.7
        ]
      ],
      "extraction": {}
    },
    {
      "id": "203",
      "role": "member",
      "code": "CZ",
      "name": "Czech Republic",
      "iso": "CZE",
      "center": [
        15.5,
        49.75
      ],
      "bounds": [
        [
          12.1,
          48.6
        ],
        [
          18.9,
          51.1
        ]
      ],
      "extraction": {}
    },
    {
      "id": "208",
      "role": "member",
      "code": "DK",
      "name": "Denmark",
      "iso": "DNK",
      "center": [
        10,
        56
      ],
      "bounds": [
        [
          8.1,
          54.6
        ],
        [
          15.2,
          57.7
        ]
      ],
      "extraction": {
        "mainlandPolygon": 1
      }
    },
    {
      "id": "233",
      "role": "member",
      "code": "EE",
      "name": "Estonia",
      "iso": "EST",
      "center": [
        25.5,
        59
      ],
      "bounds": [
        [
          21.8,
          57.5
        ],
        [
          28.2,
          59.7
        ]
      ],
      "extraction": {}
    },
    {
      "id": "246",
      "role": "member",
      "code": "FI",
      "name": "Finland",
      "iso": "FIN",
      "center": [
        26,
        64
      ],
      "bounds": [
        [
          20.5,
          59.8
        ],
        [
          31.6,
          70.1
        ]
      ],
      "extraction": {}
    },
    {
      "id": "250",
      "role": "member",
      "code": "FR",
      "name": "France",
      "iso": "FRA",
      "center": [
        2.5,
        46.5
      ],
      "bounds": [
        [
          -5,
          41
        ],
        [
          10,
          51
        ]
      ],
      "extraction": {
        "polygonIndices": [
          0,
          1
        ]
      }
    },
    {
      "id": "276",
      "role": "member",
      "code": "DE",
      "name": "Germany",
      "iso": "DEU",
      "center": [
        10.5,
        51
      ],
      "bounds": [
        [
          5.9,
          47.3
        ],
        [
          15,
          55.1
        ]
      ],
      "extraction": {}
    },
    {
      "id": "300",
      "role": "member",
      "code": "GR",
      "name": "Greece",
      "iso": "GRC",
      "center": [
        22,
        39
      ],
      "bounds": [
        [
          19.4,
          34.8
        ],
        [
          28.2,
          41.7
        ]
      ],
      "extraction": {}
    },
    {
      "id": "348",
      "role": "member",
      "code": "HU",
      "name": "Hungary",
      "iso": "HUN",
      "center": [
        19.5,
        47
      ],
      "bounds": [
        [
          16.1,
          45.7
        ],
        [
          22.9,
          48.6
        ]
      ],
      "extraction": {}
    },
    {
      "id": "372",
      "role": "member",
      "code": "IE",
      "name": "Ireland",
      "iso": "IRL",
      "center": [
        -8,
        53.5
      ],
      "bounds": [
        [
          -10.5,
          51.4
        ],
        [
          -5.4,
          55.4
        ]
      ],
      "extraction": {}
    },
    {
      "id": "380",
      "role": "member",
      "code": "IT",
      "name": "Italy",
      "iso": "ITA",
      "center": [
        12.5,
        42.8
      ],
      "bounds": [
        [
          6.6,
          36.6
        ],
        [
          18.5,
          47.1
        ]
      ],
      "extraction": {}
    },
    {
      "id": "428",
      "role": "member",
      "code": "LV",
      "name": "Latvia",
      "iso": "LVA",
      "center": [
        25,
        57
      ],
      "bounds": [
        [
          21,
          55.7
        ],
        [
          28.2,
          58.1
        ]
      ],
      "extraction": {}
    },
    {
      "id": "440",
      "role": "member",
      "code": "LT",
      "name": "Lithuania",
      "iso": "LTU",
      "center": [
        24,
        55.5
      ],
      "bounds": [
        [
          21,
          53.9
        ],
        [
          26.8,
          56.5
        ]
      ],
      "extraction": {}
    },
    {
      "id": "442",
      "role": "member",
      "code": "LU",
      "name": "Luxembourg",
      "iso": "LUX",
      "center": [
        6.13,
        49.75
      ],
      "bounds": [
        [
          5.7,
          49.4
        ],
        [
          6.5,
          50.2
        ]
      ],
      "extraction": {}
    },
    {
      "id": "470",
      "role": "member",
      "code": "MT",
      "name": "Malta",
      "iso": "MLT",
      "center": [
        14.4,
        35.9
      ],
      "bounds": [
        [
          14.2,
          35.8
        ],
        [
          14.6,
          36.1
        ]
      ],
      "extraction": {}
    },
    {
      "id": "528",
      "role": "member",
      "code": "NL",
      "name": "Netherlands",
      "iso": "NLD",
      "center": [
        5.5,
        52.5
      ],
      "bounds": [
        [
          3.4,
          50.8
        ],
        [
          7.2,
          53.6
        ]
      ],
      "extraction": {
        "mainlandPolygon": 0
      }
    },
    {
      "id": "616",
      "role": "member",
      "code": "PL",
      "name": "Poland",
      "iso": "POL",
      "center": [
        19.5,
        52
      ],
      "bounds": [
        [
          14.1,
          49
        ],
        [
          24.2,
          54.8
        ]
      ],
      "extraction": {}
    },
    {
      "id": "620",
      "role": "member",
      "code": "PT",
      "name": "Portugal",
      "iso": "PRT",
      "center": [
        -8,
        39.5
      ],
      "bounds": [
        [
          -9.5,
          37
        ],
        [
          -6.2,
          42.2
        ]
      ],
      "extraction": {
        "mainlandPolygon": 1
      }
    },
    {
      "id": "642",
      "role": "member",
      "code": "RO",
      "name": "Romania",
      "iso": "ROU",
      "center": [
        25,
        46
      ],
      "bounds": [
        [
          20.3,
          43.6
        ],
        [
          29.7,
          48.3
        ]
      ],
      "extraction": {}
    },
    {
      "id": "703",
      "role": "member",
      "code": "SK",
      "name": "Slovakia",
      "iso": "SVK",
      "center": [
        19.5,
        48.7
      ],
      "bounds": [
        [
          16.8,
          47.7
        ],
        [
          22.6,
          49.6
        ]
      ],
      "extraction": {}
    },
    {
      "id": "705",
      "role": "member",
      "code": "SI",
      "name": "Slovenia",
      "iso": "SVN",
      "center": [
        14.8,
        46.1
      ],
      "bounds": [
        [
          13.4,
          45.4
        ],
        [
          16.6,
          46.9
        ]
      ],
      "extraction": {}
    },
    {
      "id": "724",
      "role": "member",
      "code": "ES",
      "name": "Spain",
      "iso": "ESP",
      "center": [
        -4,
        40
      ],
      "bounds": [
        [
          -9.3,
          36
        ],
        [
          4.3,
          43.8
        ]
      ],
      "extraction": {
        "mainlandPolygon": 4
      }
    },
    {
      "id": "752",
      "role": "member",
      "code": "SE",
      "name": "Sweden",
      "iso": "SWE",
      "center": [
        15,
        62
      ],
      "bounds": [
        [
          11,
          55.3
        ],
        [
          24.2,
          69.1
        ]
      ],
      "extraction": {}
    },
    {
      "id": "250-GP",
      "role": "secondary",
      "code": "FR-GP",
      "name": "Guadeloupe",
      "iso": "GLP",
      "region": "Caribbean",
      "center": [
        -61.46,
        16.14
      ],
      "bounds": [
        [
          -61.81,
          15.83
        ],
        [
          -61,
          16.52
        ]
      ],
      "extraction": {
        "extractFrom": "250",
        "polygonIndices": [
          6,
          7,
          8
        ]
      }
    },
    {
      "id": "250-MQ",
      "role": "secondary",
      "code": "FR-MQ",
      "name": "Martinique",
      "iso": "MTQ",
      "region": "Caribbean",